### DISCUSSION TITLE
Unable receive udp/coap message

### DISCUSSION THREAD

**Discussion by donaldkohcw** [openthread/openthread#11323] [Q&A]
Hello, 

I am having an issue receiving any inbound messages on my OTBR interfaced with an ESP OT-RCP. I have no issues sending messages to Thread devices.

I also have no issues using ping between them. Is there any guidance on how to enable inbound message reception on obtr? Thanks.

Regards,
dk

This is my Linux ipaddr:

sudo ot-ctl ipaddr
fd4a:2c7:139b:b96:0:ff:fe00:fc11
fd76:f765:9e44:1:157f:4e49:f534:fd13
fd4a:2c7:139b:b96:0:ff:fe00:fc10
fd4a:2c7:139b:b96:0:ff:fe00:fc38
fd4a:2c7:139b:b96:0:ff:fe00:fc00
fd4a:2c7:139b:b96:0:ff:fe00:a000
fd4a:2c7:139b:b96:728:f37c:4e8a:b25
fe80:0:0:0:7067:2618:b927:3cce
Done

Ping example from device to otbr sucessfully:

 ping fd4a:2c7:139b:b96:0:ff:fe00:fc11

16 bytes from fd4a:2c7:139b:b96:0:ff:fe00:fc11: icmp_seq=3 hlim=64 time=79ms
1 packets transmitted, 1 packets received. Packet loss = 0.0%. Round-trip min/avg/max = 79/79.0/79 ms.
Done

**Comment by jwhui** [comment]
Are you using OT CLI to test UDP / CoAP message exchange? If so, can you provide the exact commands that you used?

**Reply by dk77148** [reply]
Hi @jwhui, thanks for following up.

Message sent from device "udp send fd3a:231d:458b:9544:0:ff:fe00:fc11 12345 "hello""

I can see my OTBR log shows that a UDP packet is being forward within the thread network
"Mar 05 09:55:28 donaldkoh-VMware-Virtual-Platform otbr-agent[3605]: 00:42:52.977 [I] MeshForwarder-: src:[fd3a:231d:458b:9544:8d64:a07a:93d2:6ae]:49155
Mar 05 09:55:28 donaldkoh-VMware-Virtual-Platform otbr-agent[3605]: 00:42:52.977 [I] MeshForwarder-: dst:[fd3a:231d:458b:9544:0:ff:fe00:fc11]:12345"

I tried different method to listen
1)sudo tcpdump -i wpan0 udp port 12345 -vv
2)nc -ul -6 :: 12345

I also disable the firewall
1)sudo ufw disable
2)sudo iptables -F

I run "sudo ss -anu | grep 12345, seems like UDP socket is listening
UNCONN 0 0 *:12345 : "

I also try sudo tcpdump -i any udp port 12345 but don't see anything appears.

Is there anything i can do to enable the listener?

Regards,
dk

**Reply by abtink** [reply]
Suggest trying out a different address like this one `fd76:f765:9e44:1:157f:4e49:f534:fd13` or `fd4a:2c7:139b:b96:728:f37c:4e8a:b25`.

The address `fd4a:2c7:139b:b96:0:ff:fe00:fc11` is an ALOC address (which I guess may not be exposed on your host side).

**Reply by abtink** [reply]
Check this guide about address types -> https://openthread.io/guides/thread-primer/ipv6-addressing

**Reply by dk77148** [reply]
Hi Abtink, 

This is myhost ipaddr:
sudo ot-ctl ipaddr
fd3a:231d:458b:9544:0:ff:fe00:fc11
fd3a:231d:458b:9544:0:ff:fe00:fc10
fd3a:231d:458b:9544:0:ff:fe00:fc38
fd3a:231d:458b:9544:0:ff:fe00:fc00
fd3a:231d:458b:9544:0:ff:fe00:6c00
fdc5:61d5:bd6e:1:c441:9814:bcaa:e476
fd3a:231d:458b:9544:97b6:23d9:8862:5103
fe80:0:0:0:4490:a449:353d:3743
Done

I udp send "> udp send fdc5:61d5:bd6e:1:c441:9814:bcaa:e476 12345 "hello"". below is the log capture by OBTR.

ar 05 11:21:37 donaldkoh-VMware-Virtual-Platform otbr-agent[5428]: 00:16:21.179 [I] MeshForwarder-:     src:[fdc5:61d5:bd6e:1:64ea:dd62:5009:926e]:49155
Mar 05 11:21:37 donaldkoh-VMware-Virtual-Platform otbr-agent[5428]: 00:16:21.179 [I] MeshForwarder-:     dst:[fdc5:61d5:bd6e:1:c441:9814:bcaa:e476]:12345
Mar 05 11:21:41 donaldkoh-VMware-Virtual-Platform otbr-agent[5428]: 00:16:25.194 [I] MeshForwarder-: Received IPv6 UDP msg, len:91, chksum:da75, ecn:no, from:3272dd21a93ca901, sec:no, prio:net, rss:-34.0

I also tried  udp send  fd3a:231d:458b:9544:97b6:23d9:8862:5103 12345 "hello"

Mar 05 11:23:45 donaldkoh-VMware-Virtual-Platform otbr-agent[5428]: 00:18:29.487 [I] MeshForwarder-:     src:[fd3a:231d:458b:9544:8d64:a07a:93d2:6ae]:49155
Mar 05 11:23:45 donaldkoh-VMware-Virtual-Platform otbr-agent[5428]: 00:18:29.487 [I] MeshForwarder-:     dst:[fd3a:231d:458b:9544:97b6:23d9:8862:5103]:12345

but when i "nc -ul -6 :: 12345" in another terminal, i still can't capture any word sent. 

Regards,
dk

**Reply by jwhui** [reply]
The `ipaddr` command lists the IPv6 addresses within OpenThread. When using netcat, what matters is the IPv6 addresses assigned to the Linux network interface.

Can you share the output of `ifconfig` for the `wpan0` interface on Linux?

**Reply by donaldkohcw** [reply]
hi @jwhui, 

Please find below:

donaldkoh@donaldkoh-VMware-Virtual-Platform:~/ot-br-posix$ ifconfig wpan0
wpan0: flags=4305<UP,POINTOPOINT,RUNNING,NOARP,MULTICAST>  mtu 1280
        inet6 fd3a:231d:458b:9544:0:ff:fe00:fc10  prefixlen 64  scopeid 0x0<global>
        inet6 fd3a:231d:458b:9544:0:ff:fe00:6c00  prefixlen 64  scopeid 0x0<global>
        inet6 fd3a:231d:458b:9544:0:ff:fe00:fc38  prefixlen 64  scopeid 0x0<global>
        inet6 fd3a:231d:458b:9544:97b6:23d9:8862:5103  prefixlen 64  scopeid 0x0<global>
        inet6 fe80::4490:a449:353d:3743  prefixlen 64  scopeid 0x20<link>
        inet6 fd3a:231d:458b:9544:0:ff:fe00:fc00  prefixlen 64  scopeid 0x0<global>
        inet6 fd3a:231d:458b:9544:0:ff:fe00:fc11  prefixlen 64  scopeid 0x0<global>
        unspec 00-00-00-00-00-00-00-00-00-00-00-00-00-00-00-00  txqueuelen 500  (UNSPEC)
        RX packets 1194  bytes 108833 (108.8 KB)
        RX errors 0  dropped 2  overruns 0  frame 0
        TX packets 20  bytes 3460 (3.4 KB)
        TX errors 0  dropped 2 overruns 0  carrier 0  collisions 0

**Reply by dk77148** [reply]
Hi @jwhui. @abtink ,

Just to check, is the UDP traffic likely not delivered through the Linux network stack in this case? Is there any straightforward solution where I can open, bind, and receive the UDP messages?

Or is the traffic processed internally by the OpenThread stack, meaning I need to interface with the OpenThread API since the OTBR agent manages its own internal UDP sockets? If so, could you point me to a reference for implementing the UDP receiver feature?

Please advise. Thanks!

Regards,
dk

**Reply by jwhui** [reply]
OpenThread should forward the packets to the Linux host and they should be visible on the Linux network interface. But it's not clear why that's not happening in your setup.

To get more visibility, can you provide a pcap from the `wpan0` interface and the OpenThread logs?

**Reply by dk77148** [reply]
Hi @jwhui 

Thanks for following up. This is my obtr.log:

donaldkoh@donaldkoh-VMware-Virtual-Platform:~$ cat otbr.log
Mar 06 10:20:20 donaldkoh-VMware-Virtual-Platform otbr-agent[3554]: 01:28:49.873 [I] MeshForwarder-:     dst:[ff02:0:0:0:0:0:0:1]:19788
Mar 06 10:20:20 donaldkoh-VMware-Virtual-Platform otbr-agent[3554]: 01:28:49.874 [I] Mle-----------: Receive Advertisement (fe80:0:0:0:3072:dd21:a93c:a901,0xd800)
Mar 06 10:20:24 donaldkoh-VMware-Virtual-Platform otbr-agent[3554]: 01:28:53.632 [I] Mle-----------: Send Advertisement (ff02:0:0:0:0:0:0:1)
Mar 06 10:20:25 donaldkoh-VMware-Virtual-Platform otbr-agent[3554]: 01:28:54.585 [I] MeshForwarder-: Sent IPv6 UDP msg, len:91, chksum:ec4d, ecn:no, to:0xffff, sec:no, prio:net
Mar 06 10:20:25 donaldkoh-VMware-Virtual-Platform otbr-agent[3554]: 01:28:54.585 [I] MeshForwarder-:     src:[fe80:0:0:0:4490:a449:353d:3743]:19788
Mar 06 10:20:25 donaldkoh-VMware-Virtual-Platform otbr-agent[3554]: 01:28:54.585 [I] MeshForwarder-:     dst:[ff02:0:0:0:0:0:0:1]:19788
Mar 06 10:20:26 donaldkoh-VMware-Virtual-Platform otbr-agent[3554]: 01:28:55.293 [I] Mle-----------: Send Announce on channel 18
Mar 06 10:20:26 donaldkoh-VMware-Virtual-Platform otbr-agent[3554]: 01:28:55.325 [I] MeshForwarder-: Sent IPv6 UDP msg, len:83, chksum:d015, ecn:no, to:0xffff, sec:yes, prio:net
Mar 06 10:20:26 donaldkoh-VMware-Virtual-Platform otbr-agent[3554]: 01:28:55.325 [I] MeshForwarder-:     src:[fe80:0:0:0:4490:a449:353d:3743]:19788
Mar 06 10:20:26 donaldkoh-VMware-Virtual-Platform otbr-agent[3554]: 01:28:55.325 [I] MeshForwarder-:     dst:[ff02:0:0:0:0:0:0:1]:19788
Mar 06 10:20:31 donaldkoh-VMware-Virtual-Platform otbr-agent[3554]: 01:29:00.563 [I] Mle-----------: Send Advertisement (ff02:0:0:0:0:0:0:1)
Mar 06 10:20:31 donaldkoh-VMware-Virtual-Platform otbr-agent[3554]: 01:29:00.695 [I] MeshForwarder-: Sent IPv6 UDP msg, len:91, chksum:ea13, ecn:no, to:0xffff, sec:no, prio:net
Mar 06 10:20:31 donaldkoh-VMware-Virtual-Platform otbr-agent[3554]: 01:29:00.695 [I] MeshForwarder-:     src:[fe80:0:0:0:4490:a449:353d:3743]:19788
Mar 06 10:20:31 donaldkoh-VMware-Virtual-Platform otbr-agent[3554]: 01:29:00.695 [I] MeshForwarder-:     dst:[ff02:0:0:0:0:0:0:1]:19788
Mar 06 10:20:32 donaldkoh-VMware-Virtual-Platform otbr-agent[3554]: 01:29:01.233 [I] MeshForwarder-: Received IPv6 UDP msg, len:91, chksum:6f79, ecn:no, from:3272dd21a93ca901, sec:no, prio:net, rss:-35.0
Mar 06 10:20:32 donaldkoh-VMware-Virtual-Platform otbr-agent[3554]: 01:29:01.233 [I] MeshForwarder-:     src:[fe80:0:0:0:3072:dd21:a93c:a901]:19788
Mar 06 10:20:32 donaldkoh-VMware-Virtual-Platform otbr-agent[3554]: 01:29:01.233 [I] MeshForwarder-:     dst:[ff02:0:0:0:0:0:0:1]:19788
Mar 06 10:20:32 donaldkoh-VMware-Virtual-Platform otbr-agent[3554]: 01:29:01.233 [I] Mle-----------: Receive Advertisement (fe80:0:0:0:3072:dd21:a93c:a901,0xd800)
Mar 06 10:20:38 donaldkoh-VMware-Virtual-Platform otbr-agent[3554]: 01:29:07.202 [I] MeshForwarder-: Received IPv6 UDP msg, len:54, chksum:77fc, ecn:no, from:0xd800, sec:yes, prio:normal, rss:-34.0
Mar 06 10:20:38 donaldkoh-VMware-Virtual-Platform otbr-agent[3554]: 01:29:07.203 [I] MeshForwarder-:     src:[fd3a:231d:458b:9544:8d64:a07a:93d2:6ae]:49155
Mar 06 10:20:38 donaldkoh-VMware-Virtual-Platform otbr-agent[3554]: 01:29:07.203 [I] MeshForwarder-:     dst:[fd3a:231d:458b:9544:97b6:23d9:8862:5103]:12345
Mar 06 10:20:40 donaldkoh-VMware-Virtual-Platform otbr-agent[3554]: 01:29:09.333 [I] MeshForwarder-: Received IPv6 UDP msg, len:91, chksum:7efd, ecn:no, from:3272dd21a93ca901, sec:no, prio:net, rss:-35.0
Mar 06 10:20:40 donaldkoh-VMware-Virtual-Platform otbr-agent[3554]: 01:29:09.333 [I] MeshForwarder-:     src:[fe80:0:0:0:3072:dd21:a93c:a901]:19788
Mar 06 10:20:40 donaldkoh-VMware-Virtual-Platform otbr-agent[3554]: 01:29:09.333 [I] MeshForwarder-:     dst:[ff02:0:0:0:0:0:0:1]:19788
Mar 06 10:20:40 donaldkoh-VMware-Virtual-Platform otbr-agent[3554]: 01:29:09.333 [I] Mle-----------: Receive Advertisement (fe80:0:0:0:3072:dd21:a93c:a901,0xd800)
Mar 06 10:20:44 donaldkoh-VMware-Virtual-Platform otbr-agent[3554]: 01:29:13.399 [I] Mle-----------: Send Advertisement (ff02:0:0:0:0:0:0:1)
Mar 06 10:20:44 donaldkoh-VMware-Virtual-Platform otbr-agent[3554]: 01:29:13.704 [I] MeshForwarder-: Sent IPv6 UDP msg, len:91, chksum:df1b, ecn:no, to:0xffff, sec:no, prio:net
Mar 06 10:20:44 donaldkoh-VMware-Virtual-Platform otbr-agent[3554]: 01:29:13.705 [I] MeshForwarder-:     src:[fe80:0:0:0:4490:a449:353d:3743]:19788
Mar 06 10:20:44 donaldkoh-VMware-Virtual-Platform otbr-agent[3554]: 01:29:13.705 [I] MeshForwarder-:     dst:[ff02:0:0:0:0:0:0:1]:19788
Mar 06 10:20:47 donaldkoh-VMware-Virtual-Platform otbr-agent[3554]: 01:29:16.400 [I] Mle-----------: Send Announce on channel 19
Mar 06 10:20:48 donaldkoh-VMware-Virtual-Platform otbr-agent[3554]: 01:29:17.415 [I] MeshForwarder-: Sent IPv6 UDP msg, len:83, chksum:43a4, ecn:no, to:0xffff, sec:yes, prio:net
Mar 06 10:20:48 donaldkoh-VMware-Virtual-Platform otbr-agent[3554]: 01:29:17.415 [I] MeshForwarder-:     src:[fe80:0:0:0:4490:a449:353d:3743]:19788
Mar 06 10:20:48 donaldkoh-VMware-Virtual-Platform otbr-agent[3554]: 01:29:17.415 [I] MeshForwarder-:     dst:[ff02:0:0:0:0:0:0:1]:19788
Mar 06 10:20:51 donaldkoh-VMware-Virtual-Platform otbr-agent[3554]: 01:29:20.792 [I] MeshForwarder-: Received IPv6 UDP msg, len:54, chksum:77fc, ecn:no, from:0xd800, sec:yes, prio:normal, rss:-34.0
Mar 06 10:20:51 donaldkoh-VMware-Virtual-Platform otbr-agent[3554]: 01:29:20.792 [I] MeshForwarder-:     src:[fd3a:231d:458b:9544:8d64:a07a:93d2:6ae]:49155
Mar 06 10:20:51 donaldkoh-VMware-Virtual-Platform otbr-agent[3554]: 01:29:20.793 [I] MeshForwarder-:     dst:[fd3a:231d:458b:9544:97b6:23d9:8862:5103]:12345
Mar 06 10:20:52 donaldkoh-VMware-Virtual-Platform otbr-agent[3554]: 01:29:21.458 [I] MeshForwarder-: Received IPv6 UDP msg, len:91, chksum:1294, ecn:no, from:3272dd21a93ca901, sec:no, prio:net, rss:-34.0
Mar 06 10:20:52 donaldkoh-VMware-Virtual-Platform otbr-agent[3554]: 01:29:21.458 [I] MeshForwarder-:     src:[fe80:0:0:0:3072:dd21:a93c:a901]:19788
Mar 06 10:20:52 donaldkoh-VMware-Virtual-Platform otbr-agent[3554]: 01:29:21.458 [I] MeshForwarder-:     dst:[ff02:0:0:0:0:0:0:1]:19788
Mar 06 10:20:52 donaldkoh-VMware-Virtual-Platform otbr-agent[3554]: 01:29:21.458 [I] Mle-----------: Receive Advertisement (fe80:0:0:0:3072:dd21:a93c:a901,0xd800)
Mar 06 10:21:00 donaldkoh-VMware-Virtual-Platform otbr-agent[3554]: 01:29:29.538 [I] Mle-----------: Send Advertisement (ff02:0:0:0:0:0:0:1)
Mar 06 10:21:00 donaldkoh-VMware-Virtual-Platform otbr-agent[3554]: 01:29:29.834 [I] MeshForwarder-: Sent IPv6 UDP msg, len:91, chksum:7433, ecn:no, to:0xffff, sec:no, prio:net
Mar 06 10:21:00 donaldkoh-VMware-Virtual-Platform otbr-agent[3554]: 01:29:29.834 [I] MeshForwarder-:     src:[fe80:0:0:0:4490:a449:353d:3743]:19788
Mar 06 10:21:00 donaldkoh-VMware-Virtual-Platform otbr-agent[3554]: 01:29:29.834 [I] MeshForwarder-:     dst:[ff02:0:0:0:0:0:0:1]:19788
Mar 06 10:21:02 donaldkoh-VMware-Virtual-Platform otbr-agent[3554]: 01:29:31.392 [I] MeshForwarder-: Received IPv6 UDP msg, len:54, chksum:77fc, ecn:no, from:0xd800, sec:yes, prio:normal, rss:-36.0
Mar 06 10:21:02 donaldkoh-VMware-Virtual-Platform otbr-agent[3554]: 01:29:31.392 [I] MeshForwarder-:     src:[fd3a:231d:458b:9544:8d64:a07a:93d2:6ae]:49155
Mar 06 10:21:02 donaldkoh-VMware-Virtual-Platform otbr-agent[3554]: 01:29:31.392 [I] MeshForwarder-:     dst:[fd3a:231d:458b:9544:97b6:23d9:8862:5103]:12345
Mar 06 10:21:08 donaldkoh-VMware-Virtual-Platform otbr-agent[3554]: 01:29:37.563 [I] MeshForwarder-: Received IPv6 UDP msg, len:91, chksum:1b2c, ecn:no, from:3272dd21a93ca901, sec:no, prio:net, rss:-37.0
Mar 06 10:21:08 donaldkoh-VMware-Virtual-Platform otbr-agent[3554]: 01:29:37.563 [I] MeshForwarder-:     src:[fe80:0:0:0:3072:dd21:a93c:a901]:19788
Mar 06 10:21:08 donaldkoh-VMware-Virtual-Platform otbr-agent[3554]: 01:29:37.563 [I] MeshForwarder-:     dst:[ff02:0:0:0:0:0:0:1]:19788
Mar 06 10:21:08 donaldkoh-VMware-Virtual-Platform otbr-agent[3554]: 01:29:37.563 [I] Mle-----------: Receive Advertisement (fe80:0:0:0:3072:dd21:a93c:a901,0xd800)
Mar 06 10:21:09 donaldkoh-VMware-Virtual-Platform otbr-agent[3554]: 01:29:38.312 [I] Mle-----------: Send Announce on channel 20
Mar 06 10:21:09 donaldkoh-VMware-Virtual-Platform otbr-agent[3554]: 01:29:38.334 [I] MeshForwarder-: Sent IPv6 UDP msg, len:83, chksum:5e0d, ecn:no, to:0xffff, sec:yes, prio:net
Mar 06 10:21:09 donaldkoh-VMware-Virtual-Platform otbr-agent[3554]: 01:29:38.334 [I] MeshForwarder-:     src:[fe80:0:0:0:4490:a449:353d:3743]:19788
Mar 06 10:21:09 donaldkoh-VMware-Virtual-Platform otbr-agent[3554]: 01:29:38.334 [I] MeshForwarder-:     dst:[ff02:0:0:0:0:0:0:1]:19788

My capture.pcap by command "

donaldkoh@donaldkoh-VMware-Virtual-Platform:~/ot-br-posix$ sudo tcpdump -i wpan0 -w capture.pcap
tcpdump: listening on wpan0, link-type RAW (Raw IP), snapshot length 262144 bytes
^C40 packets captured
40 packets received by filter
0 packets dropped by kernel

"

donaldkoh@donaldkoh-VMware-Virtual-Platform:~/ot-br-posix$ tcpdump -r capture.pcap
reading from file capture.pcap, link-type RAW (Raw IP), snapshot length 262144


10:16:56.954487 IP6 donaldkoh-VMware-Virtual-Platform.19788 > ip6-allnodes.19788: UDP, length 43
10:17:07.916524 IP6 donaldkoh-VMware-Virtual-Platform.19788 > ip6-allnodes.19788: UDP, length 43
10:17:18.687949 IP6 donaldkoh-VMware-Virtual-Platform.19788 > ip6-allnodes.19788: UDP, length 43
10:17:31.778658 IP6 donaldkoh-VMware-Virtual-Platform.19788 > ip6-allnodes.19788: UDP, length 43
10:17:47.912142 IP6 donaldkoh-VMware-Virtual-Platform.19788 > ip6-allnodes.19788: UDP, length 43
10:17:59.870273 IP6 donaldkoh-VMware-Virtual-Platform.19788 > ip6-allnodes.19788: UDP, length 43
10:18:08.276280 IP6 donaldkoh-VMware-Virtual-Platform.19788 > ip6-allnodes.19788: UDP, length 43
10:18:23.245380 IP6 donaldkoh-VMware-Virtual-Platform.19788 > ip6-allnodes.19788: UDP, length 43
10:18:31.698160 IP6 donaldkoh-VMware-Virtual-Platform.19788 > ip6-allnodes.19788: UDP, length 43
10:18:45.609004 IP6 donaldkoh-VMware-Virtual-Platform.19788 > ip6-allnodes.19788: UDP, length 43
10:18:58.941083 IP6 donaldkoh-VMware-Virtual-Platform.19788 > ip6-allnodes.19788: UDP, length 43
10:18:59.970262 IP6 donaldkoh-VMware-Virtual-Platform.19788 > ip6-allnodes.19788: UDP, length 35
10:19:11.810088 IP6 donaldkoh-VMware-Virtual-Platform.19788 > ip6-allnodes.19788: UDP, length 43
10:19:21.186228 IP6 donaldkoh-VMware-Virtual-Platform.19788 > ip6-allnodes.19788: UDP, length 35
10:19:22.561404 IP6 donaldkoh-VMware-Virtual-Platform.19788 > ip6-allnodes.19788: UDP, length 43
10:19:31.282111 IP6 donaldkoh-VMware-Virtual-Platform.19788 > ip6-allnodes.19788: UDP, length 43
10:19:42.966583 IP6 donaldkoh-VMware-Virtual-Platform.19788 > ip6-allnodes.19788: UDP, length 35
10:19:46.938848 IP6 donaldkoh-VMware-Virtual-Platform.19788 > ip6-allnodes.19788: UDP, length 43
10:19:57.455616 IP6 donaldkoh-VMware-Virtual-Platform.19788 > ip6-allnodes.19788: UDP, length 43
10:20:04.695532 IP6 donaldkoh-VMware-Virtual-Platform.19788 > ip6-allnodes.19788: UDP, length 35
10:20:08.566926 IP6 donaldkoh-VMware-Virtual-Platform.19788 > ip6-allnodes.19788: UDP, length 43
10:20:24.593977 IP6 donaldkoh-VMware-Virtual-Platform.19788 > ip6-allnodes.19788: UDP, length 43
10:20:26.254728 IP6 donaldkoh-VMware-Virtual-Platform.19788 > ip6-allnodes.19788: UDP, length 35
10:20:31.524956 IP6 donaldkoh-VMware-Virtual-Platform.19788 > ip6-allnodes.19788: UDP, length 43
10:20:44.361419 IP6 donaldkoh-VMware-Virtual-Platform.19788 > ip6-allnodes.19788: UDP, length 43
10:20:47.362320 IP6 donaldkoh-VMware-Virtual-Platform.19788 > ip6-allnodes.19788: UDP, length 35
10:21:00.500557 IP6 donaldkoh-VMware-Virtual-Platform.19788 > ip6-allnodes.19788: UDP, length 43
10:21:09.274119 IP6 donaldkoh-VMware-Virtual-Platform.19788 > ip6-allnodes.19788: UDP, length 35
10:21:12.616922 IP6 donaldkoh-VMware-Virtual-Platform.19788 > ip6-allnodes.19788: UDP, length 43
10:21:20.818589 IP6 donaldkoh-VMware-Virtual-Platform.19788 > ip6-allnodes.19788: UDP, length 43
10:21:30.285531 IP6 donaldkoh-VMware-Virtual-Platform.19788 > ip6-allnodes.19788: UDP, length 35
10:21:35.627066 IP6 donaldkoh-VMware-Virtual-Platform.19788 > ip6-allnodes.19788: UDP, length 43
10:21:45.905060 IP6 donaldkoh-VMware-Virtual-Platform.19788 > ip6-allnodes.19788: UDP, length 43
10:21:51.980276 IP6 donaldkoh-VMware-Virtual-Platform.19788 > ip6-allnodes.19788: UDP, length 35
10:21:56.489283 IP6 donaldkoh-VMware-Virtual-Platform.19788 > ip6-allnodes.19788: UDP, length 43
10:22:08.199265 IP6 donaldkoh-VMware-Virtual-Platform.19788 > ip6-allnodes.19788: UDP, length 43
10:22:13.552550 IP6 donaldkoh-VMware-Virtual-Platform.19788 > ip6-allnodes.19788: UDP, length 35
10:22:23.948447 IP6 donaldkoh-VMware-Virtual-Platform.19788 > ip6-allnodes.19788: UDP, length 43
10:22:32.339384 IP6 donaldkoh-VMware-Virtual-Platform.19788 > ip6-allnodes.19788: UDP, length 43
10:22:35.516032 IP6 donaldkoh-VMware-Virtual-Platform.19788 > ip6-allnodes.19788: UDP, length 35

Regards,
dk

**Reply by dk77148** [reply]
It seems like i can't see any source from [fd3a:231d:458b:9544:97b6:23d9:8862:5103] from wpan0 pcap file but it appears in obtr.log

Regards,
dk

**Comment by dk77148** [comment]
![pcap](https://github.com/user-attachments/assets/343ea460-abad-42bc-89fc-e017e57159de)
