### DISCUSSION TITLE
TLS connections using OpenThread/Matter

### DISCUSSION THREAD

**Discussion by FHFS** [openthread/openthread#7784] [Q&A] [answered]
Hi everyone,

I am working with a nrf52840 and want to make use of the Azure IoT Hub.

I've checked out the Azure IoT Hub Library that exists for the nrf91, which uses the MQTT library from zephyr. The MQTT library creates zephyr sockets with mbedtls options.

I have set up a OpenThread network with a BorderRouter and other device, I can resolve hostnames through the nat64 interface and set up tcp connections to the internet.

I tried using the zephyr sockets but am unable to create a socket that does not timeout. I also cannot use getaddrinfo to resolve hostnames.

I am able to use the OpenThread TCP api to create connections but I cant create TLS connections with these.

Should I be able to use the Zephyr sockets with a OpenThread network? Or do I need to find another way

**Comment by jwhui** [comment, marked as answer]
Zephyr's `getaddrinfo` probably does not (yet) integrate with Thread's DNS services. For example, Thread defines specific mechanisms for discovering the DNS configuration info.

I believe you should be able to use Zephyr sockets with OpenThread, but I am unsure why you are not able to establish TLS/TCP connections. Maybe @LuDuda can provide some insight.

**Reply by FHFS** [reply]
Thanks for the info! It's already good to know getaddrinfo does not yet work, but the zephyr sockets should. I will try again with the zephyr sockets, maybe i'll find something.

**Reply by LuDuda** [reply]
@rlubos could you give some more information about TCP/TLS in Zephyr - on top of OT?

**Reply by rlubos** [reply]
@FHFS I don't think we have out-of-the-box example for TCP/TLS over OT with network sockets in Zephyr (we do have for UDP/DTLS sockets - see `echo_client`/`echo_server` samples), I don't see though why shouldn't it work. Just make sure to configure mbed TLS properly - you need to be extra careful here since you'd need to match both OT and TLS ciphersuite of choice requirements.

As for `getaddrinfo`, Zephyr has its own module for DNS, this is not integrated in any way with OT (apart of the fact that it should simply work over OT, since in the end it's just UDP). However, any OT-speicifc features will not be avaialble.

**Reply by FHFS** [reply]
Thanks everyone, I will try and get it to work!

**Reply by FHFS** [reply]
I've tried some things, and I got UDP connections to work with Zephyr sockets.
I can create a socket and connect to a UDP port on the Border Router. On the Border Router I recieved the data I sent using Socat. And I can see the packets with TCPDump.

However, when I try to do the same thing with a TCP connection, I get an error timeout on the socket connect. The TCP dump then shows some ICMP6 destination/port unreachable.

The code summarized:
```
char *dst_str = "[fdbb:9fbb:e58b:f471:f21d:c077:3438:5937]:8888"; // wpan0 border router
int sock = socket(AF_INET6, SOCK_STREAM, IPPROTO_TCP);
bool result = net_ipaddr_parse(dst_str, strlen(dst_str), &dst);
int res = connect(sock, &dst, sizeof(struct sockaddr_in6)); // Connection timeout 116
```
The RTT Log output:
```
[00:00:06.037,231] <inf> coap_server: socket created
[00:00:06.037,536] <dbg> net_ctx.net_context_bind: (openthread): Context 0x200080a4 binding to TCP [::]:47194 iface 1 (0x20000d00)
[00:00:09.038,757] <err> coap_server: connect -1, errno: 116
```
The TCPDump logs:
```
pi@raspberrypi:~ $ sudo tcpdump -vnni wpan0
tcpdump: listening on wpan0, link-type LINUX_SLL (Linux cooked v1), snapshot length 262144 bytes
16:31:54.878691 IP6 (hlim 63, next-header TCP (6) payload length: 24) fdbb:9fbb:e58b:f471:ebe:fe4d:5c21:8dfc.36835 > fdbb:9fbb:e58b:f471:f21d:c077:3438:5937.8888: Flags [S], cksum 0x4564 (correct), seq 3574702255, win 1280, options [mss 1280], length 0
16:31:54.878837 IP6 (flowlabel 0x7a324, hlim 64, next-header TCP (6) payload length: 24) fdbb:9fbb:e58b:f471:f21d:c077:3438:5937.8888 > fdbb:9fbb:e58b:f471:ebe:fe4d:5c21:8dfc.36835: Flags [S.], cksum 0x85e0 (correct), seq 4042643235, ack 3574702256, win 64660, options [mss 1220], length 0
16:31:54.909201 IP6 (hlim 63, next-header TCP (6) payload length: 24) fdbb:9fbb:e58b:f471:ebe:fe4d:5c21:8dfc.36835 > fdbb:9fbb:e58b:f471:f21d:c077:3438:5937.8888: Flags [S], cksum 0x4564 (correct), seq 3574702255, win 1280, options [mss 1280], length 0
16:31:54.909320 IP6 (flowlabel 0x91ba9, hlim 64, next-header TCP (6) payload length: 24) fdbb:9fbb:e58b:f471:f21d:c077:3438:5937.8888 > fdbb:9fbb:e58b:f471:ebe:fe4d:5c21:8dfc.36835: Flags [S.], cksum 0x85e0 (correct), seq 4042643235, ack 3574702256, win 64660, options [mss 1220], length 0
16:31:54.920770 IP6 (hlim 63, next-header TCP (6) payload length: 24) fdbb:9fbb:e58b:f471:ebe:fe4d:5c21:8dfc.36835 > fdbb:9fbb:e58b:f471:f21d:c077:3438:5937.8888: Flags [S], cksum 0x4564 (correct), seq 3574702255, win 1280, options [mss 1280], length 0
16:31:54.926034 IP6 (hlim 63, next-header TCP (6) payload length: 24) fdbb:9fbb:e58b:f471:ebe:fe4d:5c21:8dfc.36835 > fdbb:9fbb:e58b:f471:f21d:c077:3438:5937.8888: Flags [S], cksum 0x4564 (correct), seq 3574702255, win 1280, options [mss 1280], length 0
16:31:54.943125 IP6 (hlim 63, next-header TCP (6) payload length: 24) fdbb:9fbb:e58b:f471:ebe:fe4d:5c21:8dfc.36835 > fdbb:9fbb:e58b:f471:f21d:c077:3438:5937.8888: Flags [S], cksum 0x4564 (correct), seq 3574702255, win 1280, options [mss 1280], length 0
16:31:54.953497 IP6 (hlim 63, next-header TCP (6) payload length: 24) fdbb:9fbb:e58b:f471:ebe:fe4d:5c21:8dfc.36835 > fdbb:9fbb:e58b:f471:f21d:c077:3438:5937.8888: Flags [S], cksum 0x4564 (correct), seq 3574702255, win 1280, options [mss 1280], length 0
16:31:54.984148 IP6 (hlim 63, next-header TCP (6) payload length: 24) fdbb:9fbb:e58b:f471:ebe:fe4d:5c21:8dfc.36835 > fdbb:9fbb:e58b:f471:f21d:c077:3438:5937.8888: Flags [S], cksum 0x4564 (correct), seq 3574702255, win 1280, options [mss 1280], length 0
16:31:55.013188 IP6 (hlim 63, next-header TCP (6) payload length: 24) fdbb:9fbb:e58b:f471:ebe:fe4d:5c21:8dfc.36835 > fdbb:9fbb:e58b:f471:f21d:c077:3438:5937.8888: Flags [S], cksum 0x4564 (correct), seq 3574702255, win 1280, options [mss 1280], length 0
16:31:55.031028 IP6 (hlim 63, next-header TCP (6) payload length: 24) fdbb:9fbb:e58b:f471:ebe:fe4d:5c21:8dfc.36835 > fdbb:9fbb:e58b:f471:f21d:c077:3438:5937.8888: Flags [S], cksum 0x4564 (correct), seq 3574702255, win 1280, options [mss 1280], length 0
16:31:55.042644 IP6 (hlim 63, next-header TCP (6) payload length: 24) fdbb:9fbb:e58b:f471:ebe:fe4d:5c21:8dfc.36835 > fdbb:9fbb:e58b:f471:f21d:c077:3438:5937.8888: Flags [S], cksum 0x4564 (correct), seq 3574702255, win 1280, options [mss 1280], length 0
16:31:55.139955 IP6 (hlim 63, next-header ICMPv6 (58) payload length: 68) fdbb:9fbb:e58b:f471:ebe:fe4d:5c21:8dfc > fdbb:9fbb:e58b:f471:f21d:c077:3438:5937: [icmp6 sum ok] ICMP6, destination unreachable, unreachable port, fdbb:9fbb:e58b:f471:ebe:fe4d:5c21:8dfc tcp port 36835
16:31:55.147745 IP6 (hlim 63, next-header ICMPv6 (58) payload length: 68) fdbb:9fbb:e58b:f471:ebe:fe4d:5c21:8dfc > fdbb:9fbb:e58b:f471:f21d:c077:3438:5937: [icmp6 sum ok] ICMP6, destination unreachable, unreachable port, fdbb:9fbb:e58b:f471:ebe:fe4d:5c21:8dfc tcp port 36835
16:31:55.190628 IP6 (hlim 63, next-header ICMPv6 (58) payload length: 68) fdbb:9fbb:e58b:f471:ebe:fe4d:5c21:8dfc > fdbb:9fbb:e58b:f471:f21d:c077:3438:5937: [icmp6 sum ok] ICMP6, destination unreachable, unreachable port, fdbb:9fbb:e58b:f471:ebe:fe4d:5c21:8dfc tcp port 36835
16:31:55.203486 IP6 (hlim 63, next-header ICMPv6 (58) payload length: 68) fdbb:9fbb:e58b:f471:ebe:fe4d:5c21:8dfc > fdbb:9fbb:e58b:f471:f21d:c077:3438:5937: [icmp6 sum ok] ICMP6, destination unreachable, unreachable port, fdbb:9fbb:e58b:f471:ebe:fe4d:5c21:8dfc tcp port 36835
16:31:55.211396 IP6 (hlim 63, next-header ICMPv6 (58) payload length: 68) fdbb:9fbb:e58b:f471:ebe:fe4d:5c21:8dfc > fdbb:9fbb:e58b:f471:f21d:c077:3438:5937: [icmp6 sum ok] ICMP6, destination unreachable, unreachable port, fdbb:9fbb:e58b:f471:ebe:fe4d:5c21:8dfc tcp port 36835
16:31:55.234229 IP6 (hlim 63, next-header ICMPv6 (58) payload length: 68) fdbb:9fbb:e58b:f471:ebe:fe4d:5c21:8dfc > fdbb:9fbb:e58b:f471:f21d:c077:3438:5937: [icmp6 sum ok] ICMP6, destination unreachable, unreachable port, fdbb:9fbb:e58b:f471:ebe:fe4d:5c21:8dfc tcp port 36835
16:31:55.275978 IP6 (hlim 63, next-header ICMPv6 (58) payload length: 68) fdbb:9fbb:e58b:f471:ebe:fe4d:5c21:8dfc > fdbb:9fbb:e58b:f471:f21d:c077:3438:5937: [icmp6 sum ok] ICMP6, destination unreachable, unreachable port, fdbb:9fbb:e58b:f471:ebe:fe4d:5c21:8dfc tcp port 36835
16:31:55.282613 IP6 (hlim 63, next-header ICMPv6 (58) payload length: 68) fdbb:9fbb:e58b:f471:ebe:fe4d:5c21:8dfc > fdbb:9fbb:e58b:f471:f21d:c077:3438:5937: [icmp6 sum ok] ICMP6, destination unreachable, unreachable port, fdbb:9fbb:e58b:f471:ebe:fe4d:5c21:8dfc tcp port 36835
16:31:55.306652 IP6 (hlim 63, next-header TCP (6) payload length: 20) fdbb:9fbb:e58b:f471:ebe:fe4d:5c21:8dfc.36835 > fdbb:9fbb:e58b:f471:f21d:c077:3438:5937.8888: Flags [R], cksum 0x6169 (correct), seq 3574702256, win 0, length 0
16:31:55.314524 IP6 (hlim 63, next-header ICMPv6 (58) payload length: 68) fdbb:9fbb:e58b:f471:ebe:fe4d:5c21:8dfc > fdbb:9fbb:e58b:f471:f21d:c077:3438:5937: [icmp6 sum ok] ICMP6, destination unreachable, unreachable port, fdbb:9fbb:e58b:f471:ebe:fe4d:5c21:8dfc tcp port 36835
16:31:55.321087 IP6 (hlim 63, next-header ICMPv6 (58) payload length: 68) fdbb:9fbb:e58b:f471:ebe:fe4d:5c21:8dfc > fdbb:9fbb:e58b:f471:f21d:c077:3438:5937: [icmp6 sum ok] ICMP6, destination unreachable, unreachable port, fdbb:9fbb:e58b:f471:ebe:fe4d:5c21:8dfc tcp port 36835
16:31:55.337639 IP6 (hlim 63, next-header TCP (6) payload length: 20) fdbb:9fbb:e58b:f471:ebe:fe4d:5c21:8dfc.36835 > fdbb:9fbb:e58b:f471:f21d:c077:3438:5937.8888: Flags [R], cksum 0x6169 (correct), seq 3574702256, win 0, length 0
16:31:55.356715 IP6 (hlim 63, next-header ICMPv6 (58) payload length: 68) fdbb:9fbb:e58b:f471:ebe:fe4d:5c21:8dfc > fdbb:9fbb:e58b:f471:f21d:c077:3438:5937: [icmp6 sum ok] ICMP6, destination unreachable, unreachable port, fdbb:9fbb:e58b:f471:ebe:fe4d:5c21:8dfc tcp port 36835
16:31:55.364584 IP6 (hlim 63, next-header ICMPv6 (58) payload length: 68) fdbb:9fbb:e58b:f471:ebe:fe4d:5c21:8dfc > fdbb:9fbb:e58b:f471:f21d:c077:3438:5937: [icmp6 sum ok] ICMP6, destination unreachable, unreachable port, fdbb:9fbb:e58b:f471:ebe:fe4d:5c21:8dfc tcp port 36835
```

The same thing with the socket changed to:` int sock = socket(AF_INET6, SOCK_DGRAM, IPPROTO_UDP);`
Works perfectly.

Any idea why  I am getting the unreachable port/destination with the TCP socket? @rlubos

**Reply by rlubos** [reply]
I'm not sure where would those ICMPv6 messages come from, just tried to run TCP socket over OpenThread with slightly modified `echo_server`/`echo_client` samples (i. e. Zephyr client/server talking to each other over OT), and it seems to work w/o problem.

What looks suspicious to me in your logs are the timestamps - the initial SYN packet retransmission rate should be 200 ms, but in the logs you provide, Zephyr appears to be sending the retransmission much earlier, could there be some issue with clock configuration in your device?

Anyway, I'd try to enable TCP logs (CONFIG_NET_TCP_LOG_LEVEL_DBG=y) to see what's going on in the TCP stack, from the logs it seems that the SYN reply from the server doesn't even reach the client.

**Reply by jwhui** [reply]
@FHFS , what git commit of ot-br-posix are you using? We had an issue where OpenThread included its own TCP stack by default on the border router, which would conflict with the Linux TCP stack. Make sure you have this fix in your build https://github.com/openthread/ot-br-posix/pull/1336.

**Reply by FHFS** [reply]
I think I will start over with the echo samples and go from there. Thanks for the support guys, I'll probably be back here soon enough haha.

@jwhui I updated the ot-br-posix on my Pi today, now running `OPENTHREAD/b2132a9; POSIX; Jun 10 2022 11:06:53` with `OPENTHREAD/thread-reference-20200818-ncs1-rc3-560-g02e61a2ed; Zephyr; Apr 28 2022 13:55:39`

@rlubos I've enabled tcp debug log level:
```
[00:00:08.244,476] <inf> coap_server: socket created
[00:00:08.244,781] <dbg> net_ctx.net_context_bind: (openthread): Context 0x200080a4 binding to TCP [::]:41016 iface 1 (0x20000d00)
[00:00:08.244,873] <dbg> net_tcp.net_tcp_connect: (<log_strdup alloc failed>): context: 0x200080a4, local: <log_strdup alloc failed>, remote: <log_strdup alloc failed>
[00:00:08.245,574] <dbg> net_tcp.net_tcp_connect: (<log_strdup alloc failed>): conn: 0x20018940 src: <log_strdup alloc failed>, dst: <log_strdup alloc failed>
[00:00:08.245,727] <dbg> net_tcp.tcp_in: (<log_strdup alloc failed>): <log_strdup alloc failed>
[00:00:08.246,002] <dbg> net_tcp.tcp_out_ext: (<log_strdup alloc failed>): <log_strdup alloc failed>
[00:00:08.246,185] <dbg> net_tcp.tcp_send_process_no_lock: (<log_strdup alloc failed>): <log_strdup alloc failed> 
[00:00:08.246,398] <dbg> net_tcp.tcp_send: (<log_strdup alloc failed>): <log_strdup alloc failed>
[00:00:08.246,520] <dbg> net_tcp.tcp_in: (<log_strdup alloc failed>): LISTEN->SYN_SENT
[00:00:08.446,716] <dbg> net_tcp.tcp_send_process_no_lock: (tcp_work): SYN Seq=2491318646 Len=0 in_retransmission
[00:00:08.446,960] <dbg> net_tcp.tcp_send: (tcp_work): SYN Seq=2491318646 Len=0
[00:00:08.647,247] <dbg> net_tcp.tcp_send_process_no_lock: (<log_strdup alloc failed>): <log_strdup alloc failed> in_retransmission
[00:00:08.647,460] <dbg> net_tcp.tcp_send: (<log_strdup alloc failed>): <log_strdup alloc failed>
[00:00:08.847,747] <dbg> net_tcp.tcp_send_process_no_lock: (<log_strdup alloc failed>): <log_strdup alloc failed> in_retransmission
[00:00:08.847,961] <dbg> net_tcp.tcp_send: (<log_strdup alloc failed>): <log_strdup alloc failed>
[00:00:09.048,248] <dbg> net_tcp.tcp_send_process_no_lock: (<log_strdup alloc failed>): <log_strdup alloc failed> in_retransmission
[00:00:09.048,461] <dbg> net_tcp.tcp_send: (<log_strdup alloc failed>): <log_strdup alloc failed>
[00:00:09.248,748] <dbg> net_tcp.tcp_send_process_no_lock: (<log_strdup alloc failed>): <log_strdup alloc failed> in_retransmission
[00:00:09.248,962] <dbg> net_tcp.tcp_send: (<log_strdup alloc failed>): <log_strdup alloc failed>
[00:00:09.449,249] <dbg> net_tcp.tcp_send_process_no_lock: (<log_strdup alloc failed>): <log_strdup alloc failed> in_retransmission
[00:00:09.449,462] <dbg> net_tcp.tcp_send: (<log_strdup alloc failed>): <log_strdup alloc failed>
[00:00:09.649,749] <dbg> net_tcp.tcp_send_process_no_lock: (tcp_work): SYN Seq=2491318646 Len=0 in_retransmission
[00:00:09.649,993] <dbg> net_tcp.tcp_send: (tcp_work): SYN Seq=2491318646 Len=0
[00:00:09.850,280] <dbg> net_tcp.tcp_send_process_no_lock: (<log_strdup alloc failed>): <log_strdup alloc failed> in_retransmission
[00:00:09.850,494] <dbg> net_tcp.tcp_send: (<log_strdup alloc failed>): <log_strdup alloc failed>
[00:00:10.050,781] <dbg> net_tcp.tcp_send_process_no_lock: (<log_strdup alloc failed>): <log_strdup alloc failed> in_retransmission
[00:00:10.050,994] <dbg> net_tcp.tcp_send: (<log_strdup alloc failed>): <log_strdup alloc failed>
[00:00:10.251,281] <dbg> net_tcp.tcp_send_process_no_lock: (<log_strdup alloc failed>): <log_strdup alloc failed> in_retransmission
[00:00:10.251,312] <dbg> net_tcp.tcp_conn_unref_debug: (<log_strdup alloc failed>): conn: 0x20018940, ref_count=1 (tcp_send_process():520)
[00:00:10.251,312] <dbg> net_tcp.tcp_conn_unref_debug: (<log_strdup alloc failed>): conn: 0x20018940 is waiting on connect semaphore
[00:00:11.246,612] <dbg> net_tcp.tcp_conn_unref_debug: (openthread): conn: 0x20018940, ref_count=1 (net_tcp_connect():2358)
[00:00:11.246,795] <dbg> net_tcp.net_tcp_connect: (openthread): conn: 0x20018940, ret=-116
[00:00:11.246,826] <err> coap_server: connect -1, errno: 116
```

Maybe it could also be due to my prj.conf, since it is a mess.
```
#
# Copyright (c) 2020 Nordic Semiconductor
#
# SPDX-License-Identifier: LicenseRef-Nordic-5-Clause
#

# nRF board library
CONFIG_DK_LIBRARY=y

# Enable OpenThread CoAP support API
CONFIG_OPENTHREAD_COAP=y
CONFIG_OPENTHREAD_MTD=y
CONFIG_OPENTHREAD_FTD=n
CONFIG_OPENTHREAD_SLAAC=y
CONFIG_OPENTHREAD_MTD_NETDIAG=y
CONFIG_OPENTHREAD_THREAD_STACK_SIZE=6144
CONFIG_OPENTHREAD_NUM_MESSAGE_BUFFERS=64

CONFIG_OPENTHREAD_THREAD_VERSION_1_2=y
# CONFIG_OPENTHREAD_DUA=y
# CONFIG_OPENTHREAD_MLR=y

# Use nrf_security
# CONFIG_OPENTHREAD_NRF_SECURITY_CHOICE=y

CONFIG_CC3XX_BACKEND=n
CONFIG_OBERON_BACKEND=y

# Configure sample logging setting
CONFIG_COAP_SERVER_LOG_LEVEL_DBG=y
CONFIG_OT_COAP_UTILS_LOG_LEVEL_DBG=y

# Network shell
CONFIG_SHELL=y
CONFIG_OPENTHREAD_SHELL=y
CONFIG_SHELL_ARGC_MAX=26
CONFIG_SHELL_CMD_BUFF_SIZE=416

# Network
CONFIG_NETWORKING=y
CONFIG_NET_L2_OPENTHREAD=y
CONFIG_NET_IPV6_NBR_CACHE=n
CONFIG_NET_IPV6_MLD=n
# CONFIG_NET_RAW_MODE=n
CONFIG_NET_IPV6=y
CONFIG_NET_IPV4=n
CONFIG_NET_CONFIG_NEED_IPV4=n
CONFIG_NET_CONFIG_NEED_IPV6=y
# Network sockets
CONFIG_NET_SOCKETS=y
CONFIG_NET_SOCKETS_POSIX_NAMES=y
CONFIG_NET_SOCKETS_POLL_MAX=4
CONFIG_NET_SOCKETS_SOCKOPT_TLS=y
CONFIG_NET_SOCKETS_TLS_MAX_CONTEXTS=2
# Enable TCP support
CONFIG_NET_TCP=y # Required for SOCKET STREAM
CONFIG_NET_UDP=y # Testing UDP connection
CONFIG_OPENTHREAD_TCP_ENABLE=y

# Same network Master Key for client and server
CONFIG_OPENTHREAD_NETWORKKEY="00:11:22:33:44:55:66:77:88:99:aa:bb:cc:dd:ee:ff"
CONFIG_OPENTHREAD_NETWORK_NAME="OpenThreadDemo"
CONFIG_OPENTHREAD_PANID=4660
CONFIG_OPENTHREAD_CHANNEL=15

# disable external crystal
CONFIG_CLOCK_CONTROL_NRF_K32SRC_XTAL=n
# enable synth crystal for powered devices
CONFIG_CLOCK_CONTROL_NRF_K32SRC_SYNTH=y
# enable RC crystal for battery devices
# CONFIG_CLOCK_CONTROL_NRF_K32SRC_RC is not set

# Enable the UART driver
CONFIG_UART_ASYNC_API=y
CONFIG_UART_INTERRUPT_DRIVEN=y
CONFIG_NRFX_UARTE1=y
CONFIG_SERIAL=y

# Disabled functionalities
# Console
CONFIG_CONSOLE=n
CONFIG_UART_CONSOLE=n
CONFIG_STDOUT_CONSOLE=n
CONFIG_PRINTK=n
CONFIG_EARLY_CONSOLE=n
# Boot
CONFIG_BOOT_BANNER=n
CONFIG_BOOT_DELAY=0

CONFIG_GPIO=y
# General config
CONFIG_LOG=y
CONFIG_NET_LOG=y
CONFIG_NET_CONTEXT_LOG_LEVEL_DBG=y
CONFIG_NET_CONN_LOG_LEVEL_INF=y
# CONFIG_NET_PKT_LOG_LEVEL_DBG=y
CONFIG_NET_PKT_LOG_LEVEL_INF=y
CONFIG_NET_CONFIG_LOG_LEVEL_DBG=y
CONFIG_NET_TCP_LOG_LEVEL_DBG=y

# NEWLIB C
CONFIG_NEWLIB_LIBC=y

# DNS Settings
CONFIG_DNS_RESOLVER=y
CONFIG_DNS_SERVER_IP_ADDRESSES=y
CONFIG_DNS_SERVER1="FDAA:BB:1::2"
CONFIG_OPENTHREAD_DNS_CLIENT=y
# CONFIG_OPENTHREAD_CONFIG_DNS_CLIENT_ENABLE=y
```

**Reply by rlubos** [reply]
@FHFS So from the logs it's clear that no response reaches the TCP stack in Zephyr. The stack takes a few retransmission attempts, but eventually reports an error (timeout). I'm not sure who's to blame here, i. e. where is the SYN response lost. BTW, increasing `CONFIG_LOG_STRDUP_BUF_COUNT` should help with the alloc failures in the logger.

**Reply by jwhui** [reply]
@FHFS , when using Zephyr's TCP stack, you should make sure to disable OpenThread's TCP stack by setting `OPENTHREAD_CONFIG_TCP_ENABLE` to zero.

**Reply by FHFS** [reply]
@rlubos Thanks that worked, no more alloc failures
nRF RTT Logs:
```
[00:00:05.829,101] <inf> coap_server: socket created
[00:00:05.829,437] <dbg> net_ctx.net_context_bind: (openthread): Context 0x200071dc binding to TCP [::]:65208 iface 1 (0x20000d00)
[00:00:05.829,559] <dbg> net_tcp.net_tcp_connect: (openthread): context: 0x200071dc, local: ::, remote: fdbb:9fbb:e58b:f471:4e16:a7b9:a19b:85b7
[00:00:05.830,322] <dbg> net_tcp.net_tcp_connect: (openthread): conn: 0x200186b0 src: fdbb:9fbb:e58b:f471:6928:6263:98d3:2357, dst: fdbb:9fbb:e58b:f471:4e16:a7b9:a19b:85b7
[00:00:05.830,474] <dbg> net_tcp.tcp_in: (openthread):  [LISTEN Seq=3042098405 Ack=0]
[00:00:05.830,810] <dbg> net_tcp.tcp_out_ext: (openthread): SYN Seq=3042098405 Len=0
[00:00:05.830,993] <dbg> net_tcp.tcp_send_process_no_lock: (openthread): SYN Seq=3042098405 Len=0 
[00:00:05.831,237] <dbg> net_tcp.tcp_send: (openthread): SYN Seq=3042098405 Len=0
[00:00:05.831,359] <dbg> net_tcp.tcp_in: (openthread): LISTEN->SYN_SENT
[00:00:06.031,585] <dbg> net_tcp.tcp_send_process_no_lock: (tcp_work): SYN Seq=3042098405 Len=0 in_retransmission
[00:00:06.031,829] <dbg> net_tcp.tcp_send: (tcp_work): SYN Seq=3042098405 Len=0
[00:00:06.232,147] <dbg> net_tcp.tcp_send_process_no_lock: (tcp_work): SYN Seq=3042098405 Len=0 in_retransmission
[00:00:06.232,360] <dbg> net_tcp.tcp_send: (tcp_work): SYN Seq=3042098405 Len=0
[00:00:06.432,678] <dbg> net_tcp.tcp_send_process_no_lock: (tcp_work): SYN Seq=3042098405 Len=0 in_retransmission
[00:00:06.432,891] <dbg> net_tcp.tcp_send: (tcp_work): SYN Seq=3042098405 Len=0
[00:00:06.633,209] <dbg> net_tcp.tcp_send_process_no_lock: (tcp_work): SYN Seq=3042098405 Len=0 in_retransmission
[00:00:06.633,422] <dbg> net_tcp.tcp_send: (tcp_work): SYN Seq=3042098405 Len=0
[00:00:06.833,740] <dbg> net_tcp.tcp_send_process_no_lock: (tcp_work): SYN Seq=3042098405 Len=0 in_retransmission
[00:00:06.833,953] <dbg> net_tcp.tcp_send: (tcp_work): SYN Seq=3042098405 Len=0
[00:00:07.034,271] <dbg> net_tcp.tcp_send_process_no_lock: (tcp_work): SYN Seq=3042098405 Len=0 in_retransmission
[00:00:07.034,484] <dbg> net_tcp.tcp_send: (tcp_work): SYN Seq=3042098405 Len=0
[00:00:07.234,802] <dbg> net_tcp.tcp_send_process_no_lock: (tcp_work): SYN Seq=3042098405 Len=0 in_retransmission
[00:00:07.235,046] <dbg> net_tcp.tcp_send: (tcp_work): SYN Seq=3042098405 Len=0
[00:00:07.435,363] <dbg> net_tcp.tcp_send_process_no_lock: (tcp_work): SYN Seq=3042098405 Len=0 in_retransmission
[00:00:07.435,577] <dbg> net_tcp.tcp_send: (tcp_work): SYN Seq=3042098405 Len=0
[00:00:07.635,894] <dbg> net_tcp.tcp_send_process_no_lock: (tcp_work): SYN Seq=3042098405 Len=0 in_retransmission
[00:00:07.636,108] <dbg> net_tcp.tcp_send: (tcp_work): SYN Seq=3042098405 Len=0
[00:00:07.836,425] <dbg> net_tcp.tcp_send_process_no_lock: (tcp_work): SYN Seq=3042098405 Len=0 in_retransmission
[00:00:07.836,456] <dbg> net_tcp.tcp_conn_unref_debug: (tcp_work): conn: 0x200186b0, ref_count=1 (tcp_send_process():520)
[00:00:07.836,486] <dbg> net_tcp.tcp_conn_unref_debug: (tcp_work): conn: 0x200186b0 is waiting on connect semaphore
[00:00:08.831,481] <dbg> net_tcp.tcp_conn_unref_debug: (openthread): conn: 0x200186b0, ref_count=1 (net_tcp_connect():2358)
[00:00:08.831,634] <dbg> net_tcp.net_tcp_connect: (openthread): conn: 0x200186b0, ret=-116
[00:00:08.831,665] <err> coap_server: connect -1, errno: 116
```
TCPDump
```
pi@raspberrypi:~ $ sudo tcpdump -vnni wpan0
tcpdump: listening on wpan0, link-type LINUX_SLL (Linux cooked v1), snapshot length 262144 bytes
09:20:39.151764 IP6 (hlim 64, next-header TCP (6) payload length: 24) fdbb:9fbb:e58b:f471:6928:6263:98d3:2357.65208 > fdbb:9fbb:e58b:f471:4e16:a7b9:a19b:85b7.8888: Flags [S], cksum 0x6c6d (correct), seq 3042098405, win 1280, options [mss 1280], length 0
09:20:39.151890 IP6 (flowlabel 0x84ce9, hlim 64, next-header TCP (6) payload length: 24) fdbb:9fbb:e58b:f471:4e16:a7b9:a19b:85b7.8888 > fdbb:9fbb:e58b:f471:6928:6263:98d3:2357.65208: Flags [S.], cksum 0xd3f6 (correct), seq 747861113, ack 3042098406, win 64660, options [mss 1220], length 0
09:20:39.167425 IP6 (hlim 64, next-header TCP (6) payload length: 24) fdbb:9fbb:e58b:f471:6928:6263:98d3:2357.65208 > fdbb:9fbb:e58b:f471:4e16:a7b9:a19b:85b7.8888: Flags [S], cksum 0x6c6d (correct), seq 3042098405, win 1280, options [mss 1280], length 0
09:20:39.167527 IP6 (flowlabel 0x792de, hlim 64, next-header TCP (6) payload length: 24) fdbb:9fbb:e58b:f471:4e16:a7b9:a19b:85b7.8888 > fdbb:9fbb:e58b:f471:6928:6263:98d3:2357.65208: Flags [S.], cksum 0xd3f6 (correct), seq 747861113, ack 3042098406, win 64660, options [mss 1220], length 0
09:20:39.186784 IP6 (hlim 64, next-header TCP (6) payload length: 24) fdbb:9fbb:e58b:f471:6928:6263:98d3:2357.65208 > fdbb:9fbb:e58b:f471:4e16:a7b9:a19b:85b7.8888: Flags [S], cksum 0x6c6d (correct), seq 3042098405, win 1280, options [mss 1280], length 0
09:20:39.192294 IP6 (hlim 64, next-header TCP (6) payload length: 24) fdbb:9fbb:e58b:f471:6928:6263:98d3:2357.65208 > fdbb:9fbb:e58b:f471:4e16:a7b9:a19b:85b7.8888: Flags [S], cksum 0x6c6d (correct), seq 3042098405, win 1280, options [mss 1280], length 0
09:20:39.204992 IP6 (hlim 64, next-header TCP (6) payload length: 24) fdbb:9fbb:e58b:f471:6928:6263:98d3:2357.65208 > fdbb:9fbb:e58b:f471:4e16:a7b9:a19b:85b7.8888: Flags [S], cksum 0x6c6d (correct), seq 3042098405, win 1280, options [mss 1280], length 0
09:20:39.225213 IP6 (hlim 64, next-header TCP (6) payload length: 24) fdbb:9fbb:e58b:f471:6928:6263:98d3:2357.65208 > fdbb:9fbb:e58b:f471:4e16:a7b9:a19b:85b7.8888: Flags [S], cksum 0x6c6d (correct), seq 3042098405, win 1280, options [mss 1280], length 0
09:20:39.227953 IP6 (hlim 64, next-header TCP (6) payload length: 24) fdbb:9fbb:e58b:f471:6928:6263:98d3:2357.65208 > fdbb:9fbb:e58b:f471:4e16:a7b9:a19b:85b7.8888: Flags [S], cksum 0x6c6d (correct), seq 3042098405, win 1280, options [mss 1280], length 0
09:20:39.234459 IP6 (hlim 64, next-header TCP (6) payload length: 24) fdbb:9fbb:e58b:f471:6928:6263:98d3:2357.65208 > fdbb:9fbb:e58b:f471:4e16:a7b9:a19b:85b7.8888: Flags [S], cksum 0x6c6d (correct), seq 3042098405, win 1280, options [mss 1280], length 0
09:20:39.260976 IP6 (hlim 64, next-header TCP (6) payload length: 24) fdbb:9fbb:e58b:f471:6928:6263:98d3:2357.65208 > fdbb:9fbb:e58b:f471:4e16:a7b9:a19b:85b7.8888: Flags [S], cksum 0x6c6d (correct), seq 3042098405, win 1280, options [mss 1280], length 0
09:20:39.263874 IP6 (hlim 64, next-header TCP (6) payload length: 24) fdbb:9fbb:e58b:f471:6928:6263:98d3:2357.65208 > fdbb:9fbb:e58b:f471:4e16:a7b9:a19b:85b7.8888: Flags [S], cksum 0x6c6d (correct), seq 3042098405, win 1280, options [mss 1280], length 0
09:20:39.275362 IP6 (hlim 64, next-header ICMPv6 (58) payload length: 68) fdbb:9fbb:e58b:f471:6928:6263:98d3:2357 > fdbb:9fbb:e58b:f471:4e16:a7b9:a19b:85b7: [icmp6 sum ok] ICMP6, destination unreachable, unreachable port, fdbb:9fbb:e58b:f471:6928:6263:98d3:2357 tcp port 65208
09:20:39.304717 IP6 (hlim 64, next-header ICMPv6 (58) payload length: 68) fdbb:9fbb:e58b:f471:6928:6263:98d3:2357 > fdbb:9fbb:e58b:f471:4e16:a7b9:a19b:85b7: [icmp6 sum ok] ICMP6, destination unreachable, unreachable port, fdbb:9fbb:e58b:f471:6928:6263:98d3:2357 tcp port 65208
```

@jwhui I will keep openthread tcp disabled in the proj.conf. The result is very similar though, see above.

**Reply by rlubos** [reply]
@FHFS I've now noticed that you rely on the default net_buf/pkt count which is pretty low. I did some testing and apparently the defaults are too small for OpenThread + TCP combination (I was able to reproduce the issue you observe, the TCP client kept retransmitting the SYN packet). Try increasing the following configs in your `prj.conf` file (below values worked for me):
```
CONFIG_NET_PKT_RX_COUNT=8
CONFIG_NET_PKT_TX_COUNT=8
CONFIG_NET_BUF_RX_COUNT=32
CONFIG_NET_BUF_TX_COUNT=32
```

**Reply by FHFS** [reply]
I've tested the echo server/client samples. These indeed do work.
I've set up one nRF as server and one as client, and they are sending tcp packets.
However when I add in my Border Router, it fails. could the problem be in the RCP?

@rlubos I've added these settings to my prj.conf, but the nRF has the same timeout trying to tcp connect to the Border Router

**Reply by rlubos** [reply]
> could the problem be in the RCP?

I don't want to exclude any option, but I doubt RCP is a problem here, it shouldn't make a difference whether it forwards TCP or UDP.

>  I've added these settings to my prj.conf, but the nRF has the same timeout trying to tcp connect to the Border Router

Well, if increasing buffers didn't help, then I'm out of ideas for the moment on where the problem is.

**Reply by FHFS** [reply]
@rlubos starting over with the echo client works. I can now TCP connect to the border router, using that example. 

Thanks everyone for your help!

**Reply by FHFS** [reply]
Also I was creating sockets in event handlers, this worked for the Openthread TCP api's but not for the zephyr sockets.
Because of the echo_client example, I saw they used semaphores to resume the main thread when the connected event occurs.
